{
  "$schema": "./policy-catalog.schema.json",
  "catalogVersion": "1.0.0",
  "generatedOn": "2026-09-06",
  "about": "The normative rules of the ORES workspace, extracted from the engineering constitution in github.com/oresoftware/my-ai and published in a form other repositories and CI jobs can read. The manifestos on this site are the prose; this catalog is the same material with stable identifiers, so a check can cite a rule by id instead of restating it.",
  "sources": [
    {
      "repo": "github.com/oresoftware/my-ai",
      "path": "AGENTS.md",
      "sha256": "5d4d94e57fcafeb5a308654e806e2c10bcdff9c21cbcfbb15488000cd6448e0a",
      "lines": 1128
    },
    {
      "repo": "github.com/oresoftware/my-ai",
      "path": "original-agents.md",
      "sha256": "a2cb017184bddf33caa931134538e4c79efa17c0013f90ca04ea44eb6a005b69",
      "lines": 142
    }
  ],
  "counts": {
    "manifestos": 10,
    "sections": 24,
    "themes": 12,
    "policies": 307,
    "enforceable": 130,
    "mapped": 184,
    "byLevel": {
      "MUST": 195,
      "MAY": 11,
      "MUST_NOT": 88,
      "SHOULD": 13
    }
  },
  "manifestos": [
    {
      "number": 1,
      "slug": "peer-authorities",
      "title": "Peer Authorities",
      "url": "https://ores-manifestos.github.io/manifestos/peer-authorities/"
    },
    {
      "number": 2,
      "slug": "fail-closed",
      "title": "Fail Closed",
      "url": "https://ores-manifestos.github.io/manifestos/fail-closed/"
    },
    {
      "number": 3,
      "slug": "evidence-over-assertion",
      "title": "Evidence Over Assertion",
      "url": "https://ores-manifestos.github.io/manifestos/evidence-over-assertion/"
    },
    {
      "number": 4,
      "slug": "one-contract-one-parser",
      "title": "One Contract, One Parser",
      "url": "https://ores-manifestos.github.io/manifestos/one-contract-one-parser/"
    },
    {
      "number": 5,
      "slug": "work-does-not-sit-locally",
      "title": "Work Does Not Sit Locally",
      "url": "https://ores-manifestos.github.io/manifestos/work-does-not-sit-locally/"
    },
    {
      "number": 6,
      "slug": "merge-do-not-pick-sides",
      "title": "Merge, Don't Pick Sides",
      "url": "https://ores-manifestos.github.io/manifestos/merge-do-not-pick-sides/"
    },
    {
      "number": 7,
      "slug": "the-secondary-copy",
      "title": "The Secondary Copy",
      "url": "https://ores-manifestos.github.io/manifestos/the-secondary-copy/"
    },
    {
      "number": 8,
      "slug": "one-to-one-all-the-way-down",
      "title": "One-to-One All the Way Down",
      "url": "https://ores-manifestos.github.io/manifestos/one-to-one-all-the-way-down/"
    },
    {
      "number": 9,
      "slug": "test-orgs-are-real-users",
      "title": "Test Orgs Are Real Users",
      "url": "https://ores-manifestos.github.io/manifestos/test-orgs-are-real-users/"
    },
    {
      "number": 10,
      "slug": "secrets-have-one-home",
      "title": "Secrets Have One Home",
      "url": "https://ores-manifestos.github.io/manifestos/secrets-have-one-home/"
    }
  ],
  "sections": [
    {
      "id": "S0",
      "number": "0",
      "title": "Preamble: `# Critical agent instructions:",
      "source_lines": "1-32"
    },
    {
      "id": "S1",
      "number": "1",
      "title": "## Agent guidelines for local folder ~/codes` + `### Finding this file from inside a repository",
      "source_lines": "33-69"
    },
    {
      "id": "S2",
      "number": "2",
      "title": "## Env vars and api tokens",
      "source_lines": "71-98"
    },
    {
      "id": "S3",
      "number": "3",
      "title": "## CLI flags and environment variables",
      "source_lines": "100-130"
    },
    {
      "id": "S4",
      "number": "4",
      "title": "## Overall best practices",
      "source_lines": "133-137"
    },
    {
      "id": "S5",
      "number": "5",
      "title": "## Schema, protobuf, typespec, json-schema diesel and ORM's",
      "source_lines": "139-153"
    },
    {
      "id": "S6",
      "number": "6",
      "title": "## External platform usage: Cloudflare and GitHub Pages",
      "source_lines": "156-188"
    },
    {
      "id": "S7",
      "number": "7",
      "title": "## Credentials and durable backups for code",
      "source_lines": "190-254"
    },
    {
      "id": "S8",
      "number": "8",
      "title": "## critical 'git merge' and 'git rebase' instructions:",
      "source_lines": "256-272"
    },
    {
      "id": "S9",
      "number": "9",
      "title": "## critical git push and github instructions",
      "source_lines": "274-282"
    },
    {
      "id": "S10",
      "number": "10",
      "title": "## critical: land work without waiting to be asked",
      "source_lines": "284-311"
    },
    {
      "id": "S11",
      "number": "11",
      "title": "## Critical 'git submodule' instructions: how we do app-of-apps",
      "source_lines": "313-454"
    },
    {
      "id": "S12",
      "number": "12",
      "title": "## Critical - we almost always use this pattern:` and zed-pkg conventions",
      "source_lines": "456-487"
    },
    {
      "id": "S13–14",
      "number": "13–14",
      "title": "Sibling test orgs and repo naming conventions",
      "source_lines": "489-567"
    },
    {
      "id": "S15",
      "number": "15",
      "title": "## Backend infra",
      "source_lines": "569-573"
    },
    {
      "id": "S16",
      "number": "16",
      "title": "## Code style and coding patterns",
      "source_lines": "575-590"
    },
    {
      "id": "S17",
      "number": "17",
      "title": "## Agents reaching GitHub (Cursor, Claude Code, Codex)",
      "source_lines": "592-826"
    },
    {
      "id": "S18",
      "number": "18",
      "title": "## Agents reaching Linear",
      "source_lines": "828-857"
    },
    {
      "id": "S19",
      "number": "19",
      "title": "## Plan first, code second",
      "source_lines": "859-866"
    },
    {
      "id": "S20",
      "number": "20",
      "title": "## Red PRs, stale PRs, and mandatory cherry-pick",
      "source_lines": "868-988"
    },
    {
      "id": "S21",
      "number": "21",
      "title": "## Rust-first systems programming and scripting",
      "source_lines": "990-1014"
    },
    {
      "id": "S22",
      "number": "22",
      "title": "## Critical: never discard uncommitted working-tree changes — in any repo",
      "source_lines": "1016-1060"
    },
    {
      "id": "S23",
      "number": "23",
      "title": "## Critical: git worktrees live in <repo>/tmp/worktrees/",
      "source_lines": "1062-1127"
    },
    {
      "id": "S24",
      "number": "24",
      "title": "Appendix: rules stated only in `original-agents.md",
      "source_lines": null
    }
  ],
  "themes": [
    {
      "id": "never-lose-work",
      "statement": "Work is defined by its existence, not by its state of completion, its author, or its container. Uncommitted edits, another session's edits, a stash, a cold branch, a hunk in a five-month-old PR, and a worktree nobody claims are all work, and destroying any of them is a defect on the same footing as deleting a pushed branch — reportable, recoverable-before-anything-else, and never a legitimate step of \"cleanup\", \"sync\", or \"make CI green\". The document repeatedly converts a *prevention* rule into a *preservation* rule: you do not merely avoid the destructive command, you first move the endangered work somewhere durable (`wip/`, `rescue/`, a salvage PR) and push it. Every escape hatch git offers — `--force`, `-f`, `--hard`, `drop`, `clear`, `prune`, a filesystem `rm` — is closed unless a human names the exact command and path.\n*Instantiated by:* `uncommitted-changes-are-work`, `look-before-you-touch`, `preserve-then-sync`, `never-force-a-tree-rewrite`, `discard-is-never-implied-by-sync`, `a-refused-dirty-pull-is-the-correct-outcome`, `fleet-scripts-skip-and-report-dirty-checkouts`, `other-sessions-work-counts-too`, `recover-immediately-if-work-was-lost`, `never-force-submodule-update`, `never-discard-a-branch-without-salvage`, `rescue-a-foreign-stash-never-pop-it`, `pre-removal-inspection`, `retain-the-source-branch`, `never-filesystem-delete-a-worktree`, `never-blanket-prune-worktrees`, `keep-the-head-branch-until-salvage-merges`, `preserve-before-switching-tasks`, `pause-overlapping-edits-without-safe-ownership`, `no-reset-without-permission`, `no-destructive-ops-without-permission`.",
      "manifesto": null,
      "policies": [
        "uncommitted-changes-are-work",
        "look-before-you-touch",
        "preserve-then-sync",
        "never-force-a-tree-rewrite",
        "discard-is-never-implied-by-sync",
        "a-refused-dirty-pull-is-the-correct-outcome",
        "fleet-scripts-skip-and-report-dirty-checkouts",
        "other-sessions-work-counts-too",
        "recover-immediately-if-work-was-lost",
        "never-force-submodule-update",
        "never-discard-a-branch-without-salvage",
        "rescue-a-foreign-stash-never-pop-it",
        "pre-removal-inspection",
        "retain-the-source-branch",
        "never-filesystem-delete-a-worktree",
        "never-blanket-prune-worktrees",
        "keep-the-head-branch-until-salvage-merges",
        "preserve-before-switching-tasks",
        "pause-overlapping-edits-without-safe-ownership",
        "no-reset-without-permission",
        "no-destructive-ops-without-permission"
      ]
    },
    {
      "id": "remote-or-it-did-not-happen",